{
  "app": {
    "name": "otester tester",
    "title": "Sample API tester",
    "default_timeout_seconds": 30,
    "max_response_body_bytes": 10485760,
    "allow_insecure_tls": true,
    "persist_request_history": false
  },
  "variables": [
    {
      "id": "dev",
      "base_url": "https://sample-dev.url/",
      "environment": "dev"
    },
    {
      "id": "uat",
      "base_url": "https://sample-uat.url",
      "environment": "uat"
    },
    {
      "id": "internal",
      "base_url": "https://sample-internal.url",
      "environment": "internal"
    }
  ],
  "oauth_profiles": [
    {
      "id": "microsoft-graph",
      "name": "Microsoft Graph Client Credentials",
      "type": "microsoft_client_credentials",
      "org_id_uuid": "00000000-0000-0000-0000-000000000000",
      "client_id": "11111111-1111-1111-1111-111111111111",
      "client_secret": "replace-with-secret",
      "scope": "https://graph.microsoft.com/.default",
      "token_url": "https://login.microsoftonline.com/org-id-uuid/oauth2/v2.0/token",
      "refresh_before_expiry_seconds": 60
    }
  ],
  "endpoint_groups": [
    {
      "id": "sample-service",
      "name": "Sample Service"
    }
  ],
  "endpoints": [
    {
      "id": "sample-api",
      "name": "Sample API",
      "description": "Example OAuth protected endpoint",
      "group_id": "sample-service",
      "enabled": true,
      "method": "GET",
      "url": "{{base_url}}/sample/api/endpoint-{environment}",
      "timeout_seconds": 30,
      "auth": {
        "type": "oauth2",
        "profile_id": "microsoft-graph",
        "allow_authorization_header_override": false
      },
      "headers": [
        {
          "key": "Accept",
          "value": "application/json",
          "enabled": true
        }
      ],
      "query_parameters": [
        {
          "key": "environment",
          "value": "{{environment}}",
          "enabled": false
        }
      ],
      "body": {
        "type": "none",
        "content": ""
      }
    },
    {
      "id": "health-check",
      "name": "Health Check",
      "description": "Direct API request without OAuth",
      "group_id": "sample-service",
      "enabled": true,
      "method": "GET",
      "url": "{{base_url}}/health",
      "auth": {
        "type": "none"
      },
      "headers": [],
      "query_parameters": [],
      "body": {
        "type": "none",
        "content": ""
      }
    }
  ]
}
